{
  "$schema": "../_schema/asset.v1.json",
  "id": "viz:spinner-radar",
  "kind": "svg",
  "category": "viz",
  "title": "Spinner radar animé",
  "description": "Spinner SVG : 3 cercles concentriques + croix de coordonnées + arc de progression rotatif (animation spin 3s linear infinite). Texte central optionnel.",
  "viewBox": "0 0 160 160",
  "params": {
    "title": { "type": "string", "default": "Model Inference" },
    "centerText": { "type": "string", "default": "0.994", "description": "Texte au centre (ex: probabilité)" },
    "duration": { "type": "string", "default": "3s", "description": "Durée d'un tour" }
  },
  "tokens": ["--ct-text-strong", "--ct-surface-2", "--ct-surface-3", "--ct-text-primary"],
  "animations": ["spin"],
  "render": {
    "svg": "<svg width=\"160\" height=\"160\" viewBox=\"0 0 160 160\">\n  <defs>\n    <linearGradient id=\"spinGrad\" x1=\"0%\" y1=\"0%\" x2=\"100%\" y2=\"100%\">\n      <stop offset=\"0%\" stop-color=\"var(--ct-text-strong)\" />\n      <stop offset=\"100%\" stop-color=\"var(--ct-surface-3)\" />\n    </linearGradient>\n  </defs>\n  <circle cx=\"80\" cy=\"80\" r=\"70\" fill=\"none\" stroke=\"var(--ct-surface-2)\" stroke-width=\"1\" stroke-dasharray=\"2 4\"></circle>\n  <circle cx=\"80\" cy=\"80\" r=\"50\" fill=\"none\" stroke=\"var(--ct-surface-2)\" stroke-width=\"1\"></circle>\n  <circle cx=\"80\" cy=\"80\" r=\"30\" fill=\"none\" stroke=\"var(--ct-surface-2)\" stroke-width=\"1\" stroke-dasharray=\"2 4\"></circle>\n  <line x1=\"80\" y1=\"10\" x2=\"80\" y2=\"150\" stroke=\"var(--ct-surface-2)\" stroke-width=\"1\"></line>\n  <line x1=\"10\" y1=\"80\" x2=\"150\" y2=\"80\" stroke=\"var(--ct-surface-2)\" stroke-width=\"1\"></line>\n  <g style=\"animation: spin {{duration}} linear infinite; transform-origin: 80px 80px;\">\n    <circle cx=\"80\" cy=\"80\" r=\"50\" fill=\"none\" stroke=\"url(#spinGrad)\" stroke-width=\"3\" stroke-dasharray=\"100 250\" stroke-linecap=\"round\"></circle>\n    <circle cx=\"80\" cy=\"30\" r=\"3\" fill=\"var(--ct-text-strong)\"></circle>\n  </g>\n  <text x=\"80\" y=\"84\" fill=\"var(--ct-text-primary)\" font-size=\"11\" font-weight=\"600\" font-family=\"monospace\" text-anchor=\"middle\" letter-spacing=\"0.1em\">{{centerText}}</text>\n</svg>",
    "css": ".spinner-container { display: flex; align-items: center; justify-content: center; margin-top: auto; margin-bottom: auto; }\n@keyframes spin { from { transform: rotate(0deg); } to { transform: rotate(360deg); } }"
  }
}
