{
  "$schema": "../_schema/asset.v1.json",
  "id": "viz:tesseract",
  "kind": "html",
  "category": "viz",
  "title": "Tesseract CSS 3D",
  "description": "Hypercube CSS pure — 2 cubes imbriqués (outer + inner), chacun avec 6 faces translucides en bordure, l'animation fait tourner les 2 cubes en sens opposés autour de plusieurs axes.",
  "params": {
    "title": { "type": "string", "default": "Tesseract Core" },
    "outerSize": { "type": "string", "default": "80px" },
    "innerSize": { "type": "string", "default": "40px" }
  },
  "tokens": ["--ct-text-strong", "--ct-text-muted"],
  "animations": ["tesseractRotateOuter", "tesseractRotateInner"],
  "render": {
    "html": "<div class=\"tesseract-container\">\n  <div class=\"tesseract-scene\">\n    <div class=\"tesseract-cube outer\">\n      <div class=\"tesseract-face front\"></div><div class=\"tesseract-face back\"></div>\n      <div class=\"tesseract-face right\"></div><div class=\"tesseract-face left\"></div>\n      <div class=\"tesseract-face top\"></div><div class=\"tesseract-face bottom\"></div>\n    </div>\n    <div class=\"tesseract-cube inner\">\n      <div class=\"tesseract-face front\"></div><div class=\"tesseract-face back\"></div>\n      <div class=\"tesseract-face right\"></div><div class=\"tesseract-face left\"></div>\n      <div class=\"tesseract-face top\"></div><div class=\"tesseract-face bottom\"></div>\n    </div>\n  </div>\n</div>",
    "css": ".tesseract-container { display: flex; align-items: center; justify-content: center; height: 180px; perspective: 800px; }\n.tesseract-scene { position: relative; width: 120px; height: 120px; transform-style: preserve-3d; }\n.tesseract-cube { position: absolute; top: 50%; left: 50%; transform-style: preserve-3d; }\n.tesseract-cube.outer { width: 80px; height: 80px; margin: -40px 0 0 -40px; animation: tesseractRotateOuter 12s linear infinite; }\n.tesseract-cube.inner { width: 40px; height: 40px; margin: -20px 0 0 -20px; animation: tesseractRotateInner 8s linear infinite reverse; }\n.tesseract-face { position: absolute; width: 100%; height: 100%; border: 1px solid var(--ct-text-muted); background: transparent; }\n.tesseract-cube.outer .tesseract-face { border-color: var(--ct-text-strong); }\n.tesseract-cube.outer .front  { transform: translateZ(40px); }\n.tesseract-cube.outer .back   { transform: translateZ(-40px) rotateY(180deg); }\n.tesseract-cube.outer .right  { transform: rotateY(90deg) translateZ(40px); }\n.tesseract-cube.outer .left   { transform: rotateY(-90deg) translateZ(40px); }\n.tesseract-cube.outer .top    { transform: rotateX(90deg) translateZ(40px); }\n.tesseract-cube.outer .bottom { transform: rotateX(-90deg) translateZ(40px); }\n.tesseract-cube.inner .front  { transform: translateZ(20px); }\n.tesseract-cube.inner .back   { transform: translateZ(-20px) rotateY(180deg); }\n.tesseract-cube.inner .right  { transform: rotateY(90deg) translateZ(20px); }\n.tesseract-cube.inner .left   { transform: rotateY(-90deg) translateZ(20px); }\n.tesseract-cube.inner .top    { transform: rotateX(90deg) translateZ(20px); }\n.tesseract-cube.inner .bottom { transform: rotateX(-90deg) translateZ(20px); }\n@keyframes tesseractRotateOuter { from { transform: rotateX(0) rotateY(0) rotateZ(0); } to { transform: rotateX(360deg) rotateY(360deg) rotateZ(360deg); } }\n@keyframes tesseractRotateInner { from { transform: rotateX(0) rotateY(0); } to { transform: rotateX(-360deg) rotateY(-360deg); } }"
  }
}
