{
  "$schema": "../_schema/asset.v1.json",
  "id": "viz:event-horizon",
  "kind": "canvas",
  "category": "viz",
  "title": "Trou noir / event horizon",
  "description": "300 particules en spirale qui convergent vers le centre — angle, radius, speed et size aléatoires. Effet de traînée via fillRect semi-transparent. Couleur fond et particule via --ct-bg-deep et --ct-text-strong.",
  "params": {
    "title": { "type": "string", "default": "Event Horizon" },
    "particles": { "type": "number", "default": 300 },
    "trail": { "type": "number", "default": 0.2, "description": "Opacité du voile de fond (effet de traînée)" }
  },
  "tokens": ["--ct-bg-deep", "--ct-text-strong"],
  "animations": [],
  "render": {
    "html": "<div class=\"ct-card\" data-asset=\"viz:event-horizon\">\n  <div class=\"ct-card-header\"><span class=\"ct-card-title\">{{title}}</span></div>\n  <div class=\"canvas-container\"><canvas id=\"ehCanvas\" width=\"300\" height=\"180\"></canvas></div>\n</div>",
    "css": ".canvas-container { width: 100%; aspect-ratio: 5/3; }\n.canvas-container canvas { display: block; width: 100%; height: 100%; }",
    "canvas": {
      "width": 300,
      "height": 180,
      "init": "function init(canvas, params) {\n  var ctx = canvas.getContext('2d');\n  var N = params.particles || 300;\n  var trail = params.trail != null ? params.trail : 0.2;\n  var style = getComputedStyle(canvas);\n  var bg = style.getPropertyValue('--ct-bg-deep').trim() || '#1a050b';\n  var color = style.getPropertyValue('--ct-text-strong').trim() || '#ffffff';\n  var ps = Array.from({ length: N }, function() {\n    return {\n      angle: Math.random() * Math.PI * 2,\n      radius: Math.random() * 150,\n      speed: Math.random() * 0.03 + 0.01,\n      size: Math.random() * 1.5 + 0.5\n    };\n  });\n  function hexToRgba(h, a) {\n    h = h.replace('#','');\n    if (h.length === 3) h = h.split('').map(function(c){return c+c;}).join('');\n    var r = parseInt(h.slice(0,2),16), g = parseInt(h.slice(2,4),16), b = parseInt(h.slice(4,6),16);\n    return 'rgba('+r+','+g+','+b+','+a+')';\n  }\n  function draw() {\n    ctx.fillStyle = hexToRgba(bg, trail);\n    ctx.fillRect(0, 0, 300, 180);\n    var cx = 150, cy = 90;\n    ps.forEach(function(p) {\n      p.angle += p.speed;\n      p.radius -= p.speed * 5;\n      if (p.radius < 5) { p.radius = 150; p.angle = Math.random() * Math.PI * 2; }\n      var x = cx + Math.cos(p.angle) * p.radius;\n      var y = cy + Math.sin(p.angle) * p.radius;\n      ctx.fillStyle = hexToRgba(color, Math.min(1, p.radius / 50));\n      ctx.beginPath(); ctx.arc(x, y, p.size, 0, Math.PI * 2); ctx.fill();\n    });\n    requestAnimationFrame(draw);\n  }\n  draw();\n}"
    }
  }
}
