{
  "$schema": "../_schema/asset.v1.json",
  "id": "viz:topo-mesh",
  "kind": "canvas",
  "category": "viz",
  "title": "Maillage topographique",
  "description": "Grille rows×cols projetée en perspective, déformée par une fonction sin·cos(t) — l'animation fait défiler le maillage en boucle.",
  "params": {
    "title": { "type": "string", "default": "Neural Topography" },
    "rows": { "type": "number", "default": 15 },
    "cols": { "type": "number", "default": 20 },
    "speed": { "type": "number", "default": 0.03 },
    "amplitude": { "type": "number", "default": 30 }
  },
  "tokens": ["--ct-text-strong"],
  "animations": [],
  "render": {
    "html": "<div class=\"ct-card\" data-asset=\"viz:topo-mesh\">\n  <div class=\"ct-card-header\"><span class=\"ct-card-title\">{{title}}</span></div>\n  <div class=\"canvas-container\"><canvas id=\"topoCanvas\" width=\"300\" height=\"180\"></canvas></div>\n</div>",
    "css": ".canvas-container { width: 100%; aspect-ratio: 5/3; }\n.canvas-container canvas { display: block; width: 100%; height: 100%; }",
    "canvas": {
      "width": 300,
      "height": 180,
      "init": "function init(canvas, params) {\n  var ctx = canvas.getContext('2d');\n  var rows = params.rows || 15, cols = params.cols || 20;\n  var speed = params.speed || 0.03;\n  var amp = params.amplitude || 30;\n  var color = getComputedStyle(canvas).getPropertyValue('--ct-text-strong').trim() || '#ffffff';\n  var t = 0;\n  function draw() {\n    ctx.clearRect(0, 0, 300, 180);\n    ctx.strokeStyle = color;\n    ctx.globalAlpha = 0.2;\n    ctx.lineWidth = 1;\n    t -= speed;\n    var pts = [];\n    for (var y = 0; y < rows; y++) {\n      pts[y] = [];\n      for (var x = 0; x < cols; x++) {\n        var px = x * 20 - 50;\n        var py = y * 20;\n        var pz = Math.sin(x * 0.4 + t) * Math.cos(y * 0.4 + t) * amp;\n        var s = 300 / (300 + py);\n        pts[y][x] = { x: 150 + (px - 150) * s, y: 40 + (py + pz) * s };\n      }\n    }\n    for (var y2 = 0; y2 < rows - 1; y2++) {\n      for (var x2 = 0; x2 < cols - 1; x2++) {\n        ctx.beginPath();\n        ctx.moveTo(pts[y2][x2].x, pts[y2][x2].y);\n        ctx.lineTo(pts[y2][x2 + 1].x, pts[y2][x2 + 1].y);\n        ctx.lineTo(pts[y2 + 1][x2].x, pts[y2 + 1][x2].y);\n        ctx.stroke();\n      }\n    }\n    ctx.globalAlpha = 1;\n    requestAnimationFrame(draw);\n  }\n  draw();\n}"
    }
  }
}
