{
  "$schema": "../_schema/asset.v1.json",
  "id": "viz:globe-canvas",
  "kind": "canvas",
  "category": "viz",
  "title": "Globe 3D canvas",
  "description": "Globe rotatif — N points distribués en spirale de Fibonacci sur une sphère de rayon R, projection perspective avec rotation continue sur 2 axes. Couleur lue depuis --ct-text-strong (résolue côté JS via getComputedStyle).",
  "params": {
    "title": { "type": "string", "default": "Global Topology" },
    "points": { "type": "number", "default": 150, "description": "Nombre de points sur la sphère" },
    "radius": { "type": "number", "default": 60 },
    "speedX": { "type": "number", "default": 0.005 },
    "speedY": { "type": "number", "default": 0.01 }
  },
  "tokens": ["--ct-text-strong"],
  "animations": [],
  "render": {
    "html": "<div class=\"ct-card\" data-asset=\"viz:globe-canvas\">\n  <div class=\"ct-card-header\"><span class=\"ct-card-title\">{{title}}</span></div>\n  <div class=\"canvas-container\"><canvas id=\"globeCanvas\" width=\"300\" height=\"180\"></canvas></div>\n</div>",
    "css": ".canvas-container { width: 100%; aspect-ratio: 5/3; }\n.canvas-container canvas { display: block; width: 100%; height: 100%; }",
    "canvas": {
      "width": 300,
      "height": 180,
      "init": "function init(canvas, params) {\n  var ctx = canvas.getContext('2d');\n  var W = canvas.width, H = canvas.height;\n  var N = params.points || 150, R = params.radius || 60;\n  var speedX = params.speedX || 0.005, speedY = params.speedY || 0.01;\n  var color = getComputedStyle(canvas).getPropertyValue('--ct-text-strong').trim() || '#ffffff';\n  var points = [];\n  for (var i = 0; i < N; i++) {\n    var phi = Math.acos(1 - 2 * (i + 0.5) / N);\n    var theta = Math.PI * (1 + Math.sqrt(5)) * i;\n    points.push({\n      x: R * Math.cos(theta) * Math.sin(phi),\n      y: R * Math.sin(theta) * Math.sin(phi),\n      z: R * Math.cos(phi)\n    });\n  }\n  var ax = 0, ay = 0;\n  function draw() {\n    ctx.clearRect(0, 0, W, H);\n    ax += speedX; ay += speedY;\n    var cx = Math.cos(ax), sx = Math.sin(ax);\n    var cy = Math.cos(ay), sy = Math.sin(ay);\n    var proj = points.map(function(p) {\n      var x1 = p.x * cy - p.z * sy;\n      var z1 = p.z * cy + p.x * sy;\n      var y2 = p.y * cx - z1 * sx;\n      var z2 = z1 * cx + p.y * sx;\n      var s = 200 / (200 + z2);\n      return { x: x1 * s + W / 2, y: y2 * s + H / 2, z: z2, s: s };\n    });\n    proj.sort(function(a, b) { return b.z - a.z; });\n    proj.forEach(function(p) {\n      var a = Math.max(0.1, 1 - (p.z + R) / (R * 2));\n      ctx.beginPath();\n      ctx.arc(p.x, p.y, 1.5 * p.s, 0, Math.PI * 2);\n      ctx.globalAlpha = a;\n      ctx.fillStyle = color;\n      ctx.fill();\n    });\n    ctx.globalAlpha = 1;\n    requestAnimationFrame(draw);\n  }\n  draw();\n}"
    }
  }
}
