{
  "$schema": "../_schema/asset.v1.json",
  "id": "chart:histogram",
  "kind": "html",
  "category": "chart",
  "title": "Histogramme dark/light variants",
  "description": "Bar chart vertical CSS — chaque barre a une hauteur en % et une variante (dark/light) pour mettre en valeur le pic.",
  "params": {
    "title": { "type": "string", "default": "Operations trend" },
    "value": { "type": "string", "default": "2,846", "description": "Valeur KPI au-dessus du chart" },
    "bars": {
      "type": "array",
      "items": { "height": "number (0-100)", "variant": "'dark' | 'light'" },
      "default": [
        { "height": 40, "variant": "dark" },
        { "height": 35, "variant": "dark" },
        { "height": 50, "variant": "dark" },
        { "height": 100, "variant": "light" },
        { "height": 45, "variant": "dark" }
      ]
    }
  },
  "tokens": ["--ct-text-strong", "--ct-surface-3", "--ct-dur-base", "--ct-ease"],
  "animations": [],
  "render": {
    "html": "<div class=\"chart-wrapper\">\n  <div class=\"kpi-value\">{{value}}</div>\n  <div class=\"chart-container\">\n    {{#each bars as |bar|}}\n      <div class=\"bar {{bar.variant}}\" style=\"height: {{bar.height}}%;\"></div>\n    {{/each}}\n  </div>\n</div>",
    "css": ".chart-wrapper { display: flex; flex-direction: column; gap: 10px; height: 100%; }\n.kpi-value { font-size: 28px; font-weight: 700; color: var(--ct-text-strong); letter-spacing: -0.02em; }\n.chart-container { flex: 1; display: flex; align-items: flex-end; gap: 8px; min-height: 100px; }\n.bar { flex: 1; border-radius: 3px 3px 0 0; transition: height var(--ct-dur-base) var(--ct-ease); }\n.bar.dark { background: var(--ct-surface-3); }\n.bar.light { background: var(--ct-text-strong); }"
  }
}
