{
  "$schema": "../_schema/asset.v1.json",
  "id": "chart:storage-bar",
  "kind": "html",
  "category": "chart",
  "title": "Barre stockage multi-segments + légende",
  "description": "Barre horizontale segmentée en N zones gradient + ruler de graduations + légende dot+label en dessous. Idéal pour visualiser une allocation mémoire (weights / gradients / KV cache).",
  "params": {
    "title": { "type": "string", "default": "Tensor Allocation" },
    "value": { "type": "string", "default": "42.84 GB" },
    "total": { "type": "string", "default": "/ 64.00 GB" },
    "segments": {
      "type": "array",
      "items": { "label": "string", "width": "number (0-100)", "color": "token (--ct-*)" },
      "default": [
        { "label": "Weights",   "width": 45, "color": "--ct-text-muted" },
        { "label": "Gradients", "width": 15, "color": "--ct-text-primary" },
        { "label": "KV Cache",  "width": 7,  "color": "--ct-text-strong" }
      ]
    },
    "ruler": {
      "type": "array",
      "default": ["0", "16", "32", "48", "64"],
      "description": "Graduations textuelles sous la barre"
    }
  },
  "tokens": ["--ct-text-muted", "--ct-text-primary", "--ct-text-strong", "--ct-surface-2", "--ct-surface-3", "--ct-bg-deep"],
  "animations": [],
  "render": {
    "html": "<div class=\"storage-wrapper\">\n  <div class=\"value-header\">\n    <div class=\"kpi-value\">{{value}}</div>\n    <span class=\"value-total\">{{total}}</span>\n  </div>\n  <div class=\"storage-bar\">\n    {{#each segments as |seg|}}\n      <div style=\"width: {{seg.width}}%; background: var({{seg.color}}); border-right: 1px solid var(--ct-bg-deep);\"></div>\n    {{/each}}\n  </div>\n  <div class=\"ruler\">\n    {{#each ruler as |tick|}}<span>{{tick}}</span>{{/each}}\n  </div>\n  <div class=\"storage-legend\">\n    {{#each segments as |seg|}}\n      <div class=\"legend-item\"><div class=\"legend-dot\" style=\"background: var({{seg.color}});\"></div>{{seg.label}}</div>\n    {{/each}}\n  </div>\n</div>",
    "css": ".storage-wrapper { display: flex; flex-direction: column; gap: 12px; }\n.value-header { display: flex; align-items: baseline; justify-content: space-between; gap: 8px; }\n.kpi-value { font-size: 28px; font-weight: 700; color: var(--ct-text-strong); letter-spacing: -0.02em; font-variant-numeric: tabular-nums; }\n.value-total { color: var(--ct-text-muted); font-size: 13px; font-weight: 500; }\n.storage-bar { display: flex; height: 12px; background: var(--ct-surface-2); border-radius: 6px; overflow: hidden; }\n.ruler { display: flex; justify-content: space-between; font-size: 10px; color: var(--ct-text-muted); font-variant-numeric: tabular-nums; }\n.storage-legend { display: flex; gap: 16px; flex-wrap: wrap; font-size: 12px; color: var(--ct-text-muted); }\n.legend-item { display: flex; align-items: center; gap: 6px; }\n.legend-dot { width: 8px; height: 8px; border-radius: 2px; }"
  }
}
